{
  "type": "deck",
  "title": "SVG Checkerboard Background Test",
  "description": "市松模様SVG背景 + 半透明フレーム + テキストの組み合わせテスト",
  "format": "wide",
  "slides": [
    {
      "type": "slide",
      "style": {
        "padding": "32px"
      },
      "children": [
        {
          "type": "frame",
          "style": {
            "backgroundImage": "examples/checkerboard.svg",
            "width": "100%",
            "height": "100%",
            "padding": "32px"
          },
          "children": [
            {
              "type": "frame",
              "style": {
                "backgroundColor": "rgba(0,0,0,0.6)",
                "padding": "16px",
                "borderRadius": "12px",
                "width": "70%"
              },
              "children": [
                {
                  "type": "heading",
                  "content": "市松模様背景テスト",
                  "level": 1,
                  "style": {
                    "fontSize": "28px",
                    "fontWeight": "bold",
                    "color": "#FFFFFF",
                    "marginBottom": "8px"
                  }
                },
                {
                  "type": "text",
                  "content": "SVGの市松模様パターンを背景に使用したテストです。透過効果がわかりやすく確認できます。",
                  "style": {
                    "fontSize": "16px",
                    "color": "#E0E0E0"
                  }
                }
              ]
            }
          ]
        }
      ]
    }
  ]
}