{
  "type": "deck",
  "title": "Min-Max Dimensions Test",
  "format": "wide",
  "slides": [
    {
      "type": "slide",
      "title": "Min-Max Width and Height",
      "children": [
        {
          "type": "container",
          "style": {
            "width": "200px",
            "height": "250px",
            "padding": "10px",
            "flexDirection": "column"
          },
          "children": [
            {
              "type": "frame",
              "style": {
                "margin": "5px",
                "height": "25px",
                "backgroundColor": "#FF6B6B"
              }
            },
            {
              "type": "frame",
              "style": {
                "margin": "5px",
                "height": "100px",
                "maxHeight": "25px",
                "backgroundColor": "#4ECDC4"
              }
            },
            {
              "type": "frame",
              "style": {
                "margin": "5px",
                "height": "25px",
                "minHeight": "50px",
                "backgroundColor": "#45B7D1"
              }
            },
            {
              "type": "frame",
              "style": {
                "margin": "5px",
                "height": "25px",
                "maxWidth": "25px",
                "backgroundColor": "#96CEB4"
              }
            },
            {
              "type": "frame",
              "style": {
                "margin": "5px",
                "height": "25px",
                "width": "25px",
                "minWidth": "50px",
                "backgroundColor": "#FFEAA7"
              }
            }
          ]
        }
      ]
    }
  ]
}