{
  "type": "deck",
  "title": "AlignSelf Test",
  "format": "wide",
  "slides": [
    {
      "type": "slide",
      "title": "AlignSelf: center",
      "children": [
        {
          "type": "container",
          "style": {
            "width": "200px",
            "height": "250px",
            "padding": "10px",
            "alignItems": "flex-start"
          },
          "children": [
            {
              "type": "frame",
              "style": {
                "margin": "5px",
                "height": "50px",
                "width": "50px",
                "alignSelf": "center",
                "backgroundColor": "#FF6B6B"
              }
            },
            {
              "type": "frame",
              "style": {
                "margin": "5px",
                "height": "50px",
                "width": "50px",
                "backgroundColor": "#4ECDC4"
              }
            }
          ]
        }
      ]
    }
  ]
}