{
  "type": "deck",
  "title": "Border Test - Clean Design",
  "description": "シンプルで分かりやすいborder表示テスト（分解済み値）",
  "slides": [
    {
      "type": "slide",
      "title": "Border 2px",
      "children": [
        {
          "type": "container",
          "style": {
            "padding": "40px",
            "backgroundColor": "#ffffff"
          },
          "children": [
            {
              "type": "text",
              "style": {
                "fontSize": "16pt",
                "fontWeight": "bold",
                "marginBottom": "20px",
                "color": "#333333"
              },
              "content": "Border Width: 2px"
            },
            {
              "type": "frame",
              "style": {
                "padding": "30px",
                "backgroundColor": "#f9f9f9",
                "borderWidth": "2px",
                "borderColor": "#000000",
                "borderStyle": "solid"
              },
              "children": [
                {
                  "type": "text",
                  "style": {
                    "color": "#000000",
                    "fontSize": "14pt"
                  },
                  "content": "2pxの黒いボーダー"
                }
              ]
            }
          ]
        }
      ]
    },
    {
      "type": "slide",
      "title": "Border 4px",
      "children": [
        {
          "type": "container",
          "style": {
            "padding": "40px",
            "backgroundColor": "#ffffff"
          },
          "children": [
            {
              "type": "text",
              "style": {
                "fontSize": "16pt",
                "fontWeight": "bold",
                "marginBottom": "20px",
                "color": "#333333"
              },
              "content": "Border Width: 4px"
            },
            {
              "type": "frame",
              "style": {
                "padding": "30px",
                "backgroundColor": "#f9f9f9",
                "borderWidth": "4px",
                "borderColor": "#000000",
                "borderStyle": "solid"
              },
              "children": [
                {
                  "type": "text",
                  "style": {
                    "color": "#000000",
                    "fontSize": "14pt"
                  },
                  "content": "4pxの黒いボーダー"
                }
              ]
            }
          ]
        }
      ]
    },
    {
      "type": "slide",
      "title": "Border 8px",
      "children": [
        {
          "type": "container",
          "style": {
            "padding": "40px",
            "backgroundColor": "#ffffff"
          },
          "children": [
            {
              "type": "text",
              "style": {
                "fontSize": "16pt",
                "fontWeight": "bold",
                "marginBottom": "20px",
                "color": "#333333"
              },
              "content": "Border Width: 8px"
            },
            {
              "type": "frame",
              "style": {
                "padding": "30px",
                "backgroundColor": "#f9f9f9",
                "borderWidth": "8px",
                "borderColor": "#000000",
                "borderStyle": "solid"
              },
              "children": [
                {
                  "type": "text",
                  "style": {
                    "color": "#000000",
                    "fontSize": "14pt"
                  },
                  "content": "8pxの黒いボーダー"
                }
              ]
            }
          ]
        }
      ]
    },
    {
      "type": "slide",
      "title": "Red Border",
      "children": [
        {
          "type": "container",
          "style": {
            "padding": "40px",
            "backgroundColor": "#ffffff"
          },
          "children": [
            {
              "type": "text",
              "style": {
                "fontSize": "16pt",
                "fontWeight": "bold",
                "marginBottom": "20px",
                "color": "#333333"
              },
              "content": "Red Border: 4px"
            },
            {
              "type": "frame",
              "style": {
                "padding": "30px",
                "backgroundColor": "#f9f9f9",
                "borderWidth": "4px",
                "borderColor": "#dc2626",
                "borderStyle": "solid"
              },
              "children": [
                {
                  "type": "text",
                  "style": {
                    "color": "#000000",
                    "fontSize": "14pt"
                  },
                  "content": "4pxの赤いボーダー"
                }
              ]
            }
          ]
        }
      ]
    },
    {
      "type": "slide",
      "title": "Blue Border",
      "children": [
        {
          "type": "container",
          "style": {
            "padding": "40px",
            "backgroundColor": "#ffffff"
          },
          "children": [
            {
              "type": "text",
              "style": {
                "fontSize": "16pt",
                "fontWeight": "bold",
                "marginBottom": "20px",
                "color": "#333333"
              },
              "content": "Blue Border: 4px"
            },
            {
              "type": "frame",
              "style": {
                "padding": "30px",
                "backgroundColor": "#f9f9f9",
                "borderWidth": "4px",
                "borderColor": "#2563eb",
                "borderStyle": "solid"
              },
              "children": [
                {
                  "type": "text",
                  "style": {
                    "color": "#000000",
                    "fontSize": "14pt"
                  },
                  "content": "4pxの青いボーダー"
                }
              ]
            }
          ]
        }
      ]
    },
    {
      "type": "slide",
      "title": "Dashed Border",
      "children": [
        {
          "type": "container",
          "style": {
            "padding": "40px",
            "backgroundColor": "#ffffff"
          },
          "children": [
            {
              "type": "text",
              "style": {
                "fontSize": "16pt",
                "fontWeight": "bold",
                "marginBottom": "20px",
                "color": "#333333"
              },
              "content": "Dashed Border: 4px"
            },
            {
              "type": "frame",
              "style": {
                "padding": "30px",
                "backgroundColor": "#f9f9f9",
                "borderWidth": "4px",
                "borderColor": "#000000",
                "borderStyle": "dashed"
              },
              "children": [
                {
                  "type": "text",
                  "style": {
                    "color": "#000000",
                    "fontSize": "14pt"
                  },
                  "content": "4pxの破線ボーダー"
                }
              ]
            }
          ]
        }
      ]
    }
  ]
}