{
  "type": "deck",
  "title": "Test2-1: 2段組み+1段組みレイアウトテスト",
  "description": "左右2段組みレイアウトでのコンテンツ配置検証用テストケース",
  "format": "wide",
  "slides": [
    {
      "type": "slide",
      "style": {
        "padding": "64px"
      },
      "children": [
        {
          "type": "heading",
          "content": "2段組みレイアウトデモ",
          "level": 1,
          "style": {
            "fontSize": "28pt",
            "marginBottom": "32px",
            "width": "100%"
          }
        },
        {
          "type": "container",
          "style": {
            "flexDirection": "row",
            "width": "100%",
            "marginTop": "8px"
          },
          "children": [
            {
              "type": "container",
              "style": {
                "flex": 4,
                "backgroundColor": "#F0F8FF"
              },
              "children": [
                {
                  "type": "heading",
                  "content": "左カラム",
                  "level": 3,
                  "style": {
                    "fontSize": "20pt",
                    "marginBottom": "8px"
                  }
                },
                {
                  "type": "text",
                  "content": "これは左側のカラムです。2段組みレイアウトでは、コンテンツを左右に分割して表示します。この部分では主要な情報を記載します。",
                  "style": {
                    "fontSize": "14pt"
                  }
                }
              ]
            },
            {
              "type": "container",
              "style": {
                "flex": 4,
                "marginLeft": "8px",
                "backgroundColor": "#F0FFF0"
              },
              "children": [
                {
                  "type": "heading",
                  "content": "右カラム",
                  "level": 3,
                  "style": {
                    "fontSize": "20pt",
                    "marginBottom": "8px"
                  }
                },
                {
                  "type": "text",
                  "content": "これは右側のカラムです。補足情報や詳細な説明、関連するデータなどを配置します。レイアウトエンジンの横並び配置機能をテストします。",
                  "style": {
                    "fontSize": "14pt"
                  }
                }
              ]
            }
          ]
        },
        {
          "type": "frame",
          "style": {
            "flexDirection": "column",
            "width": "100%",
            "marginTop": "8px",
            "backgroundColor": "#aa0000"
          },
          "children": [
            {
              "type": "heading",
              "content": "下段左カラム",
              "level": 3,
              "style": {
                "fontSize": "20pt",
                "marginBottom": "8px"
              }
            },
            {
              "type": "text",
              "content": "これは下段左側のカラムです。2段組みレイアウトでは、コンテンツを左右に分割して表示します。この部分では主要な情報を記載します。",
              "style": {
                "fontSize": "14pt"
              }
            }
          ]
        }
      ]
    }
  ]
}
