{
  "type": "deck",
  "title": "Position Test",
  "format": "wide",
  "slides": [
    {
      "type": "slide",
      "title": "Position: relative",
      "children": [
        {
          "type": "container",
          "style": {
            "width": "200px",
            "height": "200px",
            "padding": "10px"
          },
          "children": [
            {
              "type": "frame",
              "style": {
                "margin": "5px",
                "height": "50px",
                "top": "20px",
                "position": "relative",
                "backgroundColor": "#FF6B6B"
              }
            }
          ]
        }
      ]
    }
  ]
}