{
  "type": "deck",
  "format": "wide",
  "title": "Test2: 2段組みレイアウトテスト (Wide)",
  "description": "左右2段組みレイアウトでのコンテンツ配置検証用テストケース - ワイド形式 (16:9, 96 DPI)",
  "slides": [
    {
      "type": "slide",
      "style": {
        "padding": "32px"
      },
      "children": [
        {
          "type": "heading",
          "content": "2段組みレイアウトデモ (Wide)",
          "level": 1,
          "style": {
            "fontSize": "28pt",
            "marginBottom": "16px",
            "width": "100%"
          }
        },
        {
          "type": "container",
          "style": {
            "flexDirection": "row",
            "width": "100%",
            "marginTop": "32px"
          },
          "children": [
            {
              "type": "container",
              "style": {
                "flex": 4,
                "backgroundColor": "#F0F8FF"
              },
              "children": [
                {
                  "type": "heading",
                  "content": "左カラム",
                  "level": 3,
                  "style": {
                    "fontSize": "20pt",
                    "marginBottom": "16px"
                  }
                },
                {
                  "type": "text",
                  "content": "これは左側のカラムです。2段組みレイアウトでは、コンテンツを左右に分割して表示します。この部分では主要な情報を記載します。ワイド形式（16:9、96 DPI）での横長レイアウトを活用しています。",
                  "style": {
                    "fontSize": "14pt"
                  }
                }
              ]
            },
            {
              "type": "container",
              "style": {
                "flex": 4,
                "marginLeft": "32px",
                "backgroundColor": "#F0FFF0"
              },
              "children": [
                {
                  "type": "heading",
                  "content": "右カラム",
                  "level": 3,
                  "style": {
                    "fontSize": "20pt",
                    "marginBottom": "16px",
                    "width": "100%"
                  }
                },
                {
                  "type": "text",
                  "content": "これは右側のカラムです。補足情報や詳細な説明、関連するデータなどを配置します。レイアウトエンジンの横並び配置機能をテストします。ワイド画面での余裕のあるレイアウトが確認できます。",
                  "style": {
                    "fontSize": "14pt"
                  }
                },
                {
                  "type": "heading",
                  "content": "右カラム",
                  "level": 3,
                  "style": {
                    "fontSize": "30pt",
                    "marginTop": "16px"
                  }
                }
              ]
            }
          ]
        }
      ]
    }
  ]
}