{
  "type": "deck",
  "title": "Inset Test",
  "format": "wide",
  "slides": [
    {
      "type": "slide",
      "title": "Inset: top/left positioning",
      "children": [
        {
          "type": "frame",
          "style": {
            "width": "200px",
            "height": "200px",
            "margin": "50px",
            "borderWidth": "1px",
            "borderStyle": "solid",
            "borderColor": "#666666"
          },
          "children": [
            {
              "type": "frame",
              "style": {
                "height": "50px",
                "width": "50px",
                "top": "50px",
                "left": "50px",
                "backgroundColor": "#FF6B6B"
              }
            }
          ]
        }
      ]
    }
  ]
}